category,question,option1,option2,option3,option4,correct
社會,由於生物科技的應用可能會有潛在的影響，因此政府必須對疫苗的研發與製作嚴格規範、管理，為民眾的健康把關。,○,×,,,1
社會,戰後的臺灣因為電力使用更加普及，因此經濟能力較好的家庭會購買黑白電視機。,○,×,,,1
社會,太陽能板如果架設在溼地，可能會破壞自然生態。,○,×,,,1
社會,現代人已能利用生物科技改良農作物的特性，生產出品質更好的蔬果。例如：「臺南１５號」香瓜就是臺灣育成的優良品種。,○,×,,,1
社會,政府除了推動適合的能源政策外，民眾也要從生活中認識各種能源及各種節約行為。,○,×,,,1
社會,國立臺灣博物館是日治時期興建的，門口有埃及金字塔造型的裝飾。,○,×,,,2
社會,日治時期，歌手開始將自身語言融入流行歌曲的間奏或歌詞中，也出現許多本土語言的流行歌曲。,○,×,,,2
社會,近年來由於通訊傳播的進步，臺灣部分民眾會收看美國職業籃球聯賽（ＮＢＡ）等運動賽事。,○,×,,,1
社會,清帝國時期臺灣在劉銘傳的治理下，興建多座發電廠，電力於是開始被人們廣泛使用。,○,×,,,2
社會,戰後的臺灣，配合中華文化推廣政策，中國傳統書法、繪畫與音樂等，成為部分人們的休閒活動。,○,×,,,1
社會,由於電力可以提供家庭、企業或運輸工具使用，因此生產電力對人們來說很重要。,○,×,,,1
社會,臺灣擁有自己的文化，也吸收了不同的文化，進而創造出獨特的文化風格，現在更推廣到世界各國。,○,×,,,1
社會,如果想要增強農作物對害蟲的抵抗力，可以透過生物科技，改造農作物的基因。,○,×,,,1
社會,人類利用生物科技改造作物基因後，將作物直接作為食物，或是加工製成食品，就是我們常聽到的基因改造食品。,○,×,,,1
社會,能源是指能用來產生動力、電力的資源，例如：煤、石油、天然氣、風等。,○,×,,,1
社會,臺灣的蒸汽火車雖然是在清帝國開港通商後引進，但卻是在日治時期西部縱貫鐵路開通後，才成為部分民眾在島內往來、旅遊的主要運輸工具。,○,×,,,1
社會,在資訊科技出現之前，購物必須到實體商店直接選購；資訊科技出現之後，人們可以透過網路，在線上購物。,○,×,,,1
社會,日治時期，日本人曾利用蒸汽輪船大和丸號，將臺灣的香蕉運往日本。,○,×,,,1
社會,在鄭氏政權統治臺灣時，引進了蒸汽火車，對當時人們的生活造成很大的影響。,○,×,,,2
社會,由於資訊科技的進步，人們即使在山上或離島，只要能連上網路，就可以藉由手機或電腦，參與線上會議，將工作完成。,○,×,,,1
社會,歐洲聯盟已於西元２０２４年通過人工智慧法案，依據不同的風險等級，規範各種人工智慧的技術和系統。,○,×,,,1
社會,基因改造黃豆的產量穩定、品質較佳，為了鼓勵企業大量使用，政府不宜制定法律，以免阻礙基因改造黃豆相關產品的生產，進而影響經濟發展。,○,×,,,2
社會,戰後的臺灣，政府透過政策大力推廣日本、韓國流行文化，學習他國文化的優點。,○,×,,,2
社會,燃燒煤、石油以及天然氣等能源進行發電，是屬於火力發電。,○,×,,,1
社會,為了推廣再生能源發電，政府鼓勵民眾在建物頂樓裝設太陽能板，希望民眾支持再生能源。,○,×,,,1
社會,大航海時代，西方傳教士馬偕、馬雅各為了傳播基督教，利用羅馬字母拼寫閩南語，讓臺灣人學習聖經。,○,×,,,2
社會,清帝國時期傳入的傳統音樂與戲劇，逐漸發展成布袋戲、歌仔戲等臺灣戲曲，是廟會酬神的主要表演節目。,○,×,,,1
社會,西元２０００年後，在亞洲各國引發觀賞越南劇的熱潮，當時許多人到越南旅遊時，也會到拍攝景點拍照留念。,○,×,,,2
社會,本土語言是指一個地區或族群所獨有的語言，臺灣的本土語言包括閩南語、客語、原住民族語言等。,○,×,,,1
社會,日治時期，總督府興建港口，並建立臺灣與日本、中國、東北亞與東南亞之間的海上運輸航線，讓臺灣與世界的互動更頻繁。,○,×,,,1
社會,劉銘傳創辦新式學堂教授英語，是為了培養學習新知識與翻譯的人才。,○,×,,,1
社會,現在臺灣人不論工作或上學，每週都有固定的休假日，這項制度最早是自中華民國在臺灣時期開始實行。,○,×,,,2
社會,臺灣最早設置電燈照明設備，是在日治時期，當時臺中市的道路兩旁就可以看到路燈。,○,×,,,2
社會,刻寫在龜甲或獸骨上的甲骨文，演變成現在使用的中文。,○,×,,,1
社會,明華園戲劇團到國外演出，讓世界各國看見不一樣的表演，展現出與傳統布袋戲不同的風貌。,○,×,,,2
社會,目前愈來愈多攝影比賽在競賽規則上明確禁止使用ＡＩ，或另外開設使用ＡＩ創作的比賽組別，這是為了維持競賽的公平。,○,×,,,1
社會,日治時期因為興建鐵路、運用蒸汽火車，促使臺灣與世界各地的互動交流更加頻繁。,○,×,,,2
社會,恩瑜期待暑假前往美國 迪士尼樂園旅遊，這是因為臺灣的休閒文化受到美國的影響。,○,×,,,1
社會,在新住民、國際移工聚集的街道，有許多販賣東南亞飲食、物品的商店，也有機會看到越南文字的招牌。,○,×,,,1
社會,日治時期，人們欣賞的流行音樂中，有強烈節奏感和活力的搖滾音樂最受人喜愛。,○,×,,,2
社會,戰後的臺灣開始有固定的休假日，人們會進行各種休閒活動，所以當時臺灣出現了第一家唱片公司。,○,×,,,2
社會,能源科技是政府與企業的事，一般民眾無法貢獻任何力量。,○,×,,,2
社會,學會使用人工智慧的技能後，我可以將同學的臉轉移到不雅的照片上，並請其他人幫我發到不同的群組，展現我的學習成果。,○,×,,,2
社會,蒸汽機的發明會對貿易產生影響，例如：日治時期就利用蒸汽輪船航行臺灣與日本之間，載運貨物往來。,○,×,,,1
社會,戰後臺灣開始出現電視機，當時每個家庭都能添購電視機，成為人們生活的一部分。,○,×,,,2
社會,收到同學傳來的「美國總統遭恐怖分子攻擊」的影片，我們要立刻轉傳，讓別人知道這起駭人事件，轉發後再來看影片就好。,○,×,,,2
社會,我國政府至今仍未有任何規範資訊科技的法案，來處理人工智慧可能造成的亂象。,○,×,,,2
社會,人工智慧已經進步到能夠自動駕駛車輛，因此臺灣多數地區的公共汽車，都已不需要司機，改採自動駕駛了。,○,×,,,2
社會,生物科技是專指應用在高科技產業的科學技術，與我們的生活關係不大。,○,×,,,2
社會,解嚴後，姐妹一曲加入客語的和聲，使歌曲更豐富，也讓人們認識客家曲調。,○,×,,,2
社會,燃煤發電的過程中，會排放二氧化碳，造成全球氣溫升高，政府在興建燃煤發電廠時應多加考慮。,○,×,,,1
社會,使用再生能源發電能降低碳排放量、減緩空氣汙染，又不會產生後續問題，值得政府大力推廣。,○,×,,,2
社會,解嚴後，臺灣社會與文化逐漸開放，流行音樂創作除了使用本土語言，也融合了本土歌謠與西方搖滾音樂等曲調。,○,×,,,1
社會,歌仔戲是結合雕刻、彩繪、傳統音樂與掌中操偶的藝術表演。,○,×,,,2
社會,收到標題聳動的文章，應查證訊息的真實性，即使文章標註的作者真有其人，仍應多方確認、判斷真偽。,○,×,,,1
社會,由於基因改造食品對人體有害，因此政府已經全面禁止販售，並勒令下架，以免危害民眾健康。,○,×,,,2
社會,１９９０年代後，除了美國休閒娛樂持續影響臺灣外，後續僅出現了日本的戲劇、動畫、音樂等流行文化。,○,×,,,2
社會,日治時期，總督府以蒸汽輪船往來各個港口、運送物資，並建立對其他國家的海上運輸航線。,○,×,,,1
社會,大航海時代以後，有不同語言和文字傳入臺灣，這段期間也曾有人使用羅馬字母拼寫閩南語和部分原住民族的語言。,○,×,,,1
社會,身為一位消費者，我們可以參考環境部 食品藥物管理署的網站，了解食安資訊，為自己的健康把關。,○,×,,,2
社會,日治時期，總督府在臺灣興建了西部縱貫鐵路、糖業鐵路、林業鐵路等，藉由蒸汽火車，不僅能運送更多貨物、方便民眾往來，也促進觀光旅遊，對當時人們的生活產生不小的影響。,○,×,,,1
社會,如果廠商使用基因改造的原料，卻沒有在包裝上清楚標示，政府會依據食品安全衛生管理法加以處罰。,○,×,,,1
社會,堂哥用人工智慧來畫畫，既省時又省力，還得到比賽優勝，一舉數得，值得我們效法。,○,×,,,2
社會,燃燒煤或天然氣都屬於火力發電，火力發電是全球廣泛使用的發電方式。,○,×,,,1
社會,自日治時期開始，日語就是學校的課程，因此臺灣許多場所或物品上都有中 日對照的標示。,○,×,,,2
社會,為了方便向臺灣人傳教，巴克禮創辦的臺灣府城教會報以羅馬字母拼寫日語。,○,×,,,2
社會,英國的瓦特在西元十八世紀時發明了蒸汽機，將燃煤產生的動力，應用在運輸工具等方面，對人們的生活方式造成巨大的影響。,○,×,,,2
社會,戰後的臺灣，因為從總督府接收來的發電廠老舊不堪，導致電力供應不足，造成許多民眾家中的黑白電視機無法收看節目。,○,×,,,2
社會,由於基因改造後的黃豆，可以解決生長過程中的蟲害問題、提高黃豆的產量與品質，這種只有好處且無害處的生物科技應用，我們一定要大力推廣。,○,×,,,2
社會,博物館裡展示一幅十九世紀初期的英國火車畫作，我們可以推論那應該是蒸汽火車。,○,×,,,1
社會,使用人工智慧的聊天機器人蒐集資料十分方便，而且內容正確無誤，只要記得加上提供資料來源的指令，就能寫出一份完美的報告。,○,×,,,2
社會,著名作曲家鄧雨賢，曾創作出姐妹、四季紅等許多流行歌曲。,○,×,,,2
社會,如果空氣品質惡化，政府會要求發電廠減少燃煤，或改為燃燒天然氣發電，以減少空氣汙染。,○,×,,,1
社會,日治時期結束，中華民國政府接管臺灣後，立即建置太陽能板與風力發電機組，提供民眾足夠的電力，家庭也因此出現許多家電用品。,○,×,,,2
社會,近年來，人工智慧的發展愈來愈成熟，應用也愈來愈廣泛，包括自動駕駛、聊天機器人、自動鉛筆等，與我們的生活息息相關。,○,×,,,2
社會,預防傳染病的疫苗研發，屬於生物科技的應用，但藥物的研發則是醫學研究的成果，與生物科技無關。,○,×,,,2
社會,清帝國開港通商後，臺灣引進了蒸汽輪船，但是對民眾的生活影響較小，不像蒸汽火車能大量運送貨物，並方便民眾南北往來。,○,×,,,2
社會,將蒸汽機用在紡織廠取代人力，可以得到什麼好處？　,能促進國民健康　,能增加產量　,能自動設計服裝款式　,能快速運送貨物。,2
社會,下列哪一種運動賽事又稱ＮＢＡ，隨著美國的援助，以及全球通訊傳播的進步而影響臺灣社會？　,美國職業籃球聯賽　,高中籃球聯賽　,臺灣大專棒球運動聯賽　,世界棒球經典賽。,1
社會,下列何者是人類早期社會的動力來源？　,蒸汽動力　,風力　,核能　,燃燒天然氣。,2
社會,日治時期臺灣民眾如果要在島內旅遊的話，大多會採用哪一種方式？　,徒步　,搭遊艇　,搭蒸汽輪船　,搭蒸汽火車。,4
社會,政府鼓勵民眾在建物裝設什麼裝置，以實際行動支持再生能源？　,蒸汽機　,太陽能板　,燃煤發電機組　,地熱發電系統。,2
社會,閱讀下表可以得知，我們目前使用的中文字是由中國古代的某種字形演變而來，請問該字形為最有可能為下列何者？ 　 ,甲骨文　,楷書　,英文　,日文 ,1
社會,下列何者不是人工智慧的應用範圍？　,掃地機器人　,聊天機器人　,自動駕駛車　,自動鉛筆。,4
社會,當我們使用聊天機器人協助蒐集資料時，該如何處理資料來源的問題？　,使用聊天機器人蒐集資料時，不需要資料來源　,聊天機器人無法附上資料來源　,在指令中要求附上資料來源　,老師或同學詢問時再附上即可。,3
社會,下列何者不屬於火力發電使用的能源？　,石油　,天然氣　,煤　,太陽。,4
社會,臺灣受日本殖民統治五十年，總督府要求學習日語，因此對臺灣的社會有什麼影響？　,日語融入臺灣社會中，成為常見的語言或文字　,許多物品上有中 英對照的標示　,使國際移工增加　,吸引外國人來臺灣學習日文。,1
社會,瓦特改良的蒸汽機會燃燒哪一種能源來產生動力？　,煤　,核能　,風　,太陽。,1
社會,下列哪一項用品能縮短做家事的時間，減輕做家事的負擔？　,電視機　,洗衣機　,電冰箱　,電動車。,2
社會,立群放假時喜歡在家觀賞美國 迪士尼的動畫，請問這是因為臺灣的哪一種文化受到世界的影響？　,語言及文字　,傳統戲曲　,休閒娛樂　,建築形式。,3
社會,珠慧想製作臺灣四百年重大事件年表，請問下列哪一種方式能迅速蒐集大量資料？　,找同學討論　,使用聊天機器人　,到圖書館查資料　,請教長輩。,2
社會,日治時期，總督府在許多地區建立海上運輸航線，下列哪一個地方不包括在內？　,美洲南部　,日本　,東南亞　,東北亞。,1
社會,政府依據哪一個法規來管理基因改造食品？　,健康食品管理法　,食品安全衛生管理法　,憲法　,一般食品衛生標準。,2
社會,解嚴後，臺灣的流行文化逐漸改變，其中日本的哪一項文化在臺灣相當知名，除了製作成動畫，也會改編成電視劇？　,音樂劇　,長篇小說　,漫畫　,默劇。,3
社會,近年來，臺灣出現許多販賣東南亞商品或東南亞美食的店家，這個現象這反映了下列哪一種情況？　,東南亞地區經濟衰落　,臺灣新住民與國際移工增加　,東南亞黑心商品走私來臺　,英語成為全國共通語言。,2
社會,我國的人工智慧基本法草案是在哪一年提出？　,２０００年　,２０２０年　,２０２２年　,２０２４年。,4
社會,假新聞的傳播容易造成什麼結果？　,社會混亂　,網路發達　,經濟成長　,交通便捷。,1
社會,從新聞報導中，可以發現網路上有許多ＡＩ造假影片，為了避免這些影片影響我們的判斷，我們應該要培養哪一種觀念？　,賺取金錢　,節能減碳　,查證訊息　,檢討他人。,3
社會,臺灣引進使用蒸汽動力的交通運輸之後，使得臺灣更方便與世界各地交流，請問這項運輸工具最可能是下列哪一項？　,蒸氣發電機　,蒸汽火車　,蒸氣汽車　,蒸汽輪船。,4
社會,下列關於資訊科技對學習的影響，何者正確？　,資訊科技的影響主要在科技業，並未影響人們的學習　,由於資訊科技發展太過迅速，人們的學習必須回歸傳統的背誦記憶　,過去人們必須以實體方式進行學習，現在可以在線上完成學習　,過去人們以線上方式進行學習，資訊科技促使人們以實體方式從事學習。,3
社會,能源是指能被人類利用來產生動力的資源，下列何者不屬於能源？　,工廠　,風　,天然氣　,石油。,1
社會,清帝國開港通商後，哪個人曾在臺北小範圍設置電燈照明設備？　,沈葆楨　,劉銘傳　,鄭成功　,陳永華。,2
社會,臺灣從哪一個時期開始，逐漸將英語納入學校的課程中？　,清帝國時期　,大航海時代　,日治時期　,中華民國在臺灣時期。,3
社會,研發疫苗預防傳染病的擴散，是哪一種科技的應用？　,金融科技　,資訊科技　,能源科技　,生物科技。,4
社會,現代人能夠輕易的轉載、發布各種訊息，與下列哪一項因素較有關係？　,生物科技進步　,石油價格上漲　,社群軟體愈來愈多　,送信郵差人數增加。,3
社會,哪一項物品的出現，開啟電力使用的新時代，讓電力逐漸運用在照明和生產活動上？　,蒸汽機　,發電機　,電視機　,電燈。,2
社會,在新住民、國際移工聚集的街道，較不可能看見哪一種場景？　,有販賣東南亞飲食的商店　,以羅馬字母拼寫的閩南語菜單　,可以買到新住民相關的物品　,有越南文字的招牌。,2
社會,全球第一支針對傳染病開發的疫苗，是由下列哪一位醫師所研發？　,愛德華‧詹納　,蔡阿信　,杜聰明　,岡部信彥。,1
社會,我們在市面上會看到基因改造食品，但也有些人堅決反對基因改造食品，這些人反對基因改造食品的原因為何？　,因為種植時，害蟲的數量會快速增加　,因為種植時會威脅其他的作物，影響生態　,因為種植時必須投入更多的人力　,因為種植出來的數量太少，無法滿足國內需求。,2
社會,清帝國開港通商後，西方傳教士馬偕、巴克禮等人，為了傳播哪一種宗教信仰，利用羅馬字母拼寫閩南語？　,基督教　,道教　,伊斯蘭教　,佛教。,1
社會,為了改善空氣汙染問題，政府在民國１０７年修正了哪一個法規，要求在空氣品質惡化時，以燃燒天然氣取代燃煤發電？　,室內空氣品質管理法　,移動汙染源空氣汙染物排放標準　,空氣汙染防制法　,空氣品質標準。,3
社會,蒸汽機的應用範圍不包括下列哪一項？　,紡織廠　,火車　,輪船　,黑白電視機。,4
社會,國立臺灣博物館是在哪一個時期興建的？　,日治時期　,清帝國時期　,大航海時代　,中華民國在臺灣時期。,1
社會,臺灣最早是在哪一個時期引進蒸汽火車？　,史前時代　,大航海時代　,清帝國開港通商後　,日治時期。,3
社會,家中哪一種電器最可能具有人工智慧？　,電鍋　,氣炸鍋　,半自動洗衣機　,掃地機器人。,4
社會,傳統漢人的生活作息多配合自然界變化，因此休閒活動大多與什麼結合？　,農耕與狩獵　,節慶或廟會　,新生兒出生　,祖靈祭典。,2
社會,大航海時代，哪一種語言及文字傳入臺灣，至今仍在使用，該語言寫成的詩詞、文章等，是我們學習的素材？　,英語　,中文　,日語　,越南文。,2
社會,下列哪個人改良蒸汽機，讓蒸汽機能應用在火車上？　,巴克禮　,法拉第　,瓦特　,劉銘傳。,3
社會,下列何者不是判斷假訊息的正確方法？　,收到訊息立即轉傳　,要先了解訊息的出處　,先搜尋作者是否真有其人　,避免只看標題。,1
社會,發電機是由哪個人製作出來的？　,劉銘傳　,愛迪生　,法拉第　,瓦特。,3
社會,由於發電的過程會帶來什麼不良的影響，所以我們必須思考發電來源的問題？　,貧富不均　,糧食不足　,環境破壞　,引發戰爭。,3
社會,面對網路上充斥各種假訊息，現代人應該具備哪一種能力？　,判斷訊息真偽的能力　,投資理財的能力　,刻苦耐勞的能力　,大量閱讀的能力。,1
社會,日治時期，哪一位作曲家受唱片公司邀請，創作出四季紅、月夜愁等流行歌曲？　,陳澄波　,蔡阿信　,鄧雨賢　,杜聰明。,3
社會,在溼地或魚塭裝設太陽能板發電，可能會造成什麼問題？　,排放懸浮微粒　,影響當地氣候　,加速魚群生長　,破壞自然生態。,4
社會,下列哪一個生活中常見的詞語源自於日語，意思為「飯盒」？　,餐盤　,禮物　,午餐　,便當。,4
社會,日治時期開通臺灣哪裡的鐵路？　,北迴鐵路　,花 東鐵路　,南迴鐵路　,西部縱貫鐵路。,4
社會,戰後的臺灣，配合中華文化推廣政策，可以看見哪一種休閒活動？　,英語翻譯比賽　,欣賞南韓（韓國）流行歌曲　,傳統書法展　,美國職業籃球聯賽。,3
社會,有些人會用人工智慧對照片或影片進行什麼處理，導致他人名譽等受到傷害，甚至造成社會的危害？　,變聲　,美化　,化妝　,換臉。,4
社會,為什麼我們不能利用人工智慧來畫圖參加比賽？　,違反比賽的公平性　,使用人工智慧繪圖的人太多　,評審不容易分出名次　,人工智慧繪圖技巧仍不成熟。,1
社會,根據民國１０７年修正的空氣汙染防制法，當空氣品質惡化時，火力發電要改為燃燒哪一種能源來發電，以減少空氣汙染？　,石油　,煤　,天然氣　,核能。,3
社會,人們依據各自的生活方式，發展出不同的文化，這些文化不會以什麼形式傳播到世界各地，影響其他國家？　,旅行　,植栽　,貿易活動　,通訊技術。,2
社會,戰後的臺灣，政府進行什麼建設以生產更多電力供人民使用？　,大型發電廠　,國際機場　,大型煉油廠　,科學園區。,1
社會,琳達參觀國立臺灣博物館時，發現有類似希臘神廟的巨大柱子，請問兩者之間為什麼會這麼相似？　,日式建築受到外國語言的影響　,南韓（韓國）戲劇在臺灣受到歡迎　,因貿易活動增加，讓臺灣的文化特色傳到外國　,臺灣部分建築受到西方文化影響。,4
社會,下列何者不是 臺灣的本土語言？　,閩南語　,英語　,客語　,原住民族語。,2
社會,下列哪一個團體，不僅將臺灣的傳統歌仔戲融合現代劇場創新元素，更常受邀到國外演出？　,台青蕉樂團　,明華園戲劇團　,榮興客家採茶劇團　,小西園布袋戲團。,2
社會,日治時期，總督府利用哪一種運輸工具到東南亞運送物資？　,蒸汽輪船　,蒸汽火車　,飛機　,大貨車。,1
社會,日治時期，航行在臺灣與日本之間的會是下列哪一種船隻？　,人力小船　,蒸汽輪船　,觀光遊艇　,航空母艦。,2
社會,歐洲聯盟通過哪一個法案來規範人工智慧的技術和系統？　,人工智慧法案　,人工智慧基本法　,食品衛生管理法　,食品安全衛生管理法。,1
社會,劉銘傳創辦新式學堂教授英語，目的為何？　,加強對人民的控管　,改變原住民族的語言　,培養學習新知識與翻譯的人才　,吸引外國人前來臺灣學習。,3
社會,下列哪一種不屬於 日治時期從臺灣運往日本的物產？　,稻米　,蔗糖　,小麥　,香蕉。,3
社會,戰後，美國的流行歌曲傳入臺灣，其中搖滾音樂具有何種風格？　,平穩沉靜　,輕柔緩慢　,節奏感強烈　,融入大自然聲音。,3
社會,雅米公司推出一款使用基因改造黃豆製成的「古早味豆腐」，請問這款豆腐的包裝應符合下列哪一項要求？　,必須標示豆腐製作的方式　,不需要標示保存期限　,必須標示是否使用基因改造黃豆　,不需要標示製造廠商的名稱。,3
社會,下列哪一個時期，臺灣都市的街道上常會見到路燈？　,大航海時代　,鄭氏政權統治時　,清帝國開港通商後　,日治時期。,4
社會,下列何者不是人類早期社會的動力來源？　,人力　,風力　,蒸汽動力　,獸力。,3
社會,漢生想利用人工智慧協助他製作社會報告，卻和姐姐之間出現下圖的對話，根據姐姐的說法，漢生在製作報告時需要留意什麼事情？ 　 ,必須標明資料來源，並用自己的話整理　,聊天機器人是人類智慧結晶，不會出錯　,將聊天機器人的回答一字不漏貼上報告　,只要有圖片輔助就不需要附上資料來源。,1
社會,燃煤發電的過程排放的懸浮微粒會造成什麼不良影響，導致人們進行抗議？　,影響人們健康　,影響晶片生產　,加速人口老化　,影響電力的供應。,1
社會,解嚴後，臺灣出現許多融合本土語言的流行歌曲，如姐妹一曲，就加入了哪一個原住民族的和聲？　,卑南族　,阿美族　,泰雅族　,鄒族。,1
社會,媽媽上班的公司想要採用人工智慧來處理資料，請問這項措施可能會造成什麼影響？　,需要增聘許多新員工　,人們的工作可能被人工智慧取代　,需要處理的資料數量會暴增　,處理資料的速度會變慢。,2
社會,針對人工智慧發展時可能遭遇的風險，政府目前提出哪一項法案的草案來保障人們的隱私、個資及勞工權益？　,人工智慧法案　,人工智慧基本法　,食品衛生管理法　,食品安全衛生管理法。,2
社會,日治時期的臺灣，為什麼工廠能夠大量生產商品？　,警察制度建立，監控人民　,發電廠興建，電力廣泛運用　,工業教育人才培育成功　,水利建設大量完成。,2
社會,清帝國開港通商後蒸汽輪船的引進，為臺灣帶來什麼改變？　,日本占領臺灣　,引起不同族群的械鬥　,開始大量生產家電用品　,外來觀念影響民眾生活。,4
